### ISSUE TITLE
K3S-DNS-resultion-accessing external traffic

### ISSUE THREAD

**Issue by BlackTurtle123** [rancher/k3s#1288]
**Version:**
k3s version v1.17.0+k3s.1 (0f644650)

**Describe the bug**
When trying to access external resources, the first request often succeeds, following requests are getting stuck.

**To Reproduce**
Install clean k3s cluster. Create namespaces, create a service that does many external queries.

**Expected behavior**
Every calls to external should be successfull

**Actual behavior**
Calls to external networks fail. Inside the cluster it does work fine.

**Additional context**
K3S node-ip is bounded to internal IP.
K3S external-ip is bounded to external IP.
Pods that dont need external services are totally fine.
I can visit services through traefik.
The host can perfectly ping and connect to external domains.
I already tryed using FQDN (add a . at the end)
I already tryed deploying not in a namespace.
I already reinstalled the server and redeployed k3s. ( issue came back)

I added a tcp dump from the first request from the pod. IP's and dns names changed ofc. And a bit lower the output from the second call that gets lost.

```
14:33:23.487638 IP 10.35.0.220.47889 > 10.36.0.10.domain: 4210+ A? test.domain.eu. (44)
14:33:23.487684 IP 10.35.0.220.47889 > 10.35.0.212.domain: 4210+ A? test.domain.eu. (44)
14:33:23.487718 IP 10.35.0.220.47889 > 10.36.0.10.domain: 28295+ AAAA? test.domain.eu. (44)
14:33:23.487730 IP 10.35.0.220.47889 > 10.35.0.212.domain: 28295+ AAAA? test.domain.eu. (44)
14:33:23.488026 IP 10.35.0.212.domain > 10.35.0.220.47889: 28295* 0/1/0 (133)
14:33:23.488056 IP 10.36.0.10.domain > 10.35.0.220.47889: 28295* 0/1/0 (133)
14:33:23.488132 IP 10.35.0.212.domain > 10.35.0.220.47889: 4210* 1/2/0 A 173.212.206.150 (170)
14:33:23.488147 IP 10.36.0.10.domain > 10.35.0.220.47889: 4210* 1/2/0 A 173.212.206.150 (170)
14:33:23.488370 IP 10.35.0.220.33518 > test.test.net.https: Flags [S], seq 1708141299, win 28200, options [mss 1410,sackOK,TS val 1020855790 ecr 0,nop,wscale 7], length 0
14:33:23.488399 IP 10.35.0.220.33518 > test.test.net.https: Flags [S], seq 1708141299, win 28200, options [mss 1410,sackOK,TS val 1020855790 ecr 0,nop,wscale 7], length 0
14:33:23.503449 IP test.test.net.https > 10.35.0.220.33518: Flags [S.], seq 1746682751, ack 1708141300, win 28960, options [mss 1460,sackOK,TS val 3639787867 ecr 1020855790,nop,wscale 7], length 0
14:33:23.503454 IP test.test.net.https > 10.35.0.220.33518: Flags [S.], seq 1746682751, ack 1708141300, win 28960, options [mss 1460,sackOK,TS val 3639787867 ecr 1020855790,nop,wscale 7], length 0
14:33:23.503503 IP 10.35.0.220.33518 > test.test.net.https: Flags [.], ack 1, win 221, options [nop,nop,TS val 1020855806 ecr 3639787867], length 0
14:33:23.503510 IP 10.35.0.220.33518 > test.test.net.https: Flags [.], ack 1, win 221, options [nop,nop,TS val 1020855806 ecr 3639787867], length 0
14:33:23.506007 IP 10.35.0.220.33518 > test.test.net.https: Flags [P.], seq 1:518, ack 1, win 221, options [nop,nop,TS val 1020855808 ecr 3639787867], length 517
14:33:23.506019 IP 10.35.0.220.33518 > test.test.net.https: Flags [P.], seq 1:518, ack 1, win 221, options [nop,nop,TS val 1020855808 ecr 3639787867], length 517
14:33:23.521106 IP test.test.net.https > 10.35.0.220.33518: Flags [.], ack 518, win 235, options [nop,nop,TS val 3639787885 ecr 1020855808], length 0
14:33:23.521110 IP test.test.net.https > 10.35.0.220.33518: Flags [.], ack 518, win 235, options [nop,nop,TS val 3639787885 ecr 1020855808], length 0
14:33:23.523967 IP test.test.net.https > 10.35.0.220.33518: Flags [P.], seq 1:3213, ack 518, win 235, options [nop,nop,TS val 3639787888 ecr 1020855808], length 3212
14:33:23.523972 IP test.test.net.https > 10.35.0.220.33518: Flags [P.], seq 1:3213, ack 518, win 235, options [nop,nop,TS val 3639787888 ecr 1020855808], length 3212
14:33:23.524016 IP 10.35.0.220.33518 > test.test.net.https: Flags [.], ack 3213, win 271, options [nop,nop,TS val 1020855826 ecr 3639787888], length 0
14:33:23.524025 IP 10.35.0.220.33518 > test.test.net.https: Flags [.], ack 3213, win 271, options [nop,nop,TS val 1020855826 ecr 3639787888], length 0
14:33:23.526096 IP 10.35.0.220.33518 > test.test.net.https: Flags [P.], seq 518:644, ack 3213, win 271, options [nop,nop,TS val 1020855828 ecr 3639787888], length 126
14:33:23.526109 IP 10.35.0.220.33518 > test.test.net.https: Flags [P.], seq 518:644, ack 3213, win 271, options [nop,nop,TS val 1020855828 ecr 3639787888], length 126
14:33:23.541866 IP test.test.net.https > 10.35.0.220.33518: Flags [P.], seq 3213:3264, ack 644, win 235, options [nop,nop,TS val 3639787905 ecr 1020855828], length 51
14:33:23.541874 IP test.test.net.https > 10.35.0.220.33518: Flags [P.], seq 3213:3264, ack 644, win 235, options [nop,nop,TS val 3639787905 ecr 1020855828], length 51
14:33:23.542329 IP 10.35.0.220.33518 > test.test.net.https: Flags [P.], seq 644:763, ack 3264, win 271, options [nop,nop,TS val 1020855844 ecr 3639787905], length 119
14:33:23.542344 IP 10.35.0.220.33518 > test.test.net.https: Flags [P.], seq 644:763, ack 3264, win 271, options [nop,nop,TS val 1020855844 ecr 3639787905], length 119
14:33:23.560423 IP test.test.net.https > 10.35.0.220.33518: Flags [P.], seq 3264:3619, ack 763, win 235, options [nop,nop,TS val 3639787924 ecr 1020855844], length 355
14:33:23.560430 IP test.test.net.https > 10.35.0.220.33518: Flags [P.], seq 3264:3619, ack 763, win 235, options [nop,nop,TS val 3639787924 ecr 1020855844], length 355
14:33:23.560821 IP 10.35.0.220.33518 > test.test.net.https: Flags [P.], seq 763:794, ack 3619, win 293, options [nop,nop,TS val 1020855863 ecr 3639787924], length 31
14:33:23.560835 IP 10.35.0.220.33518 > test.test.net.https: Flags [P.], seq 763:794, ack 3619, win 293, options [nop,nop,TS val 1020855863 ecr 3639787924], length 31
14:33:23.560960 IP 10.35.0.220.33518 > test.test.net.https: Flags [F.], seq 794, ack 3619, win 293, options [nop,nop,TS val 1020855863 ecr 3639787924], length 0
14:33:23.560967 IP 10.35.0.220.33518 > test.test.net.https: Flags [F.], seq 794, ack 3619, win 293, options [nop,nop,TS val 1020855863 ecr 3639787924], length 0
14:33:23.576016 IP test.test.net.https > 10.35.0.220.33518: Flags [F.], seq 3619, ack 795, win 235, options [nop,nop,TS val 3639787940 ecr 1020855863], length 0
14:33:23.576025 IP test.test.net.https > 10.35.0.220.33518: Flags [F.], seq 3619, ack 795, win 235, options [nop,nop,TS val 3639787940 ecr 1020855863], length 0
14:33:23.576088 IP 10.35.0.220.33518 > test.test.net.https: Flags [.], ack 3620, win 293, options [nop,nop,TS val 1020855878 ecr 3639787940], length 0
14:33:23.576101 IP 10.35.0.220.33518 > test.test.net.https: Flags [.], ack 3620, win 293, options [nop,nop,TS val 1020855878 ecr 3639787940], length 0
```

```
14:33:30.749040 IP 10.35.0.220.55917 > 10.36.0.10.domain: 58103+ A? test.domain.eu. (44)
14:33:30.749086 IP 10.35.0.220.55917 > 10.35.0.212.domain: 58103+ A? test.domain.eu. (44)
14:33:30.749120 IP 10.35.0.220.55917 > 10.36.0.10.domain: 58901+ AAAA? test.domain.eu. (44)
14:33:30.749131 IP 10.35.0.220.55917 > 10.35.0.212.domain: 58901+ AAAA? test.domain.eu. (44)
14:33:30.749381 IP 10.35.0.212.domain > 10.35.0.220.55917: 58901* 0/1/0 (133)
14:33:30.749417 IP 10.36.0.10.domain > 10.35.0.220.55917: 58901* 0/1/0 (133)
14:33:30.749502 IP 10.35.0.212.domain > 10.35.0.220.55917: 58103* 1/2/0 A 173.212.206.150 (170)
14:33:30.749521 IP 10.36.0.10.domain > 10.35.0.220.55917: 58103* 1/2/0 A 173.212.206.150 (170)
14:33:30.749822 IP 10.35.0.220.33642 > test.test.net.https: Flags [S], seq 222418307, win 28200, options [mss 1410,sackOK,TS val 1020863052 ecr 0,nop,wscale 7], length 0
14:33:30.749850 IP 10.35.0.220.33642 > test.test.net.https: Flags [S], seq 222418307, win 28200, options [mss 1410,sackOK,TS val 1020863052 ecr 0,nop,wscale 7], length 0
14:33:31.779291 IP 10.35.0.220.33642 > test.test.net.https: Flags [S], seq 222418307, win 28200, options [mss 1410,sackOK,TS val 1020864081 ecr 0,nop,wscale 7], length 0
14:33:31.779305 IP 10.35.0.220.33642 > test.test.net.https: Flags [S], seq 222418307, win 28200, options [mss 1410,sackOK,TS val 1020864081 ecr 0,nop,wscale 7], length 0
14:33:33.799509 IP 10.35.0.220.33642 > test.test.net.https: Flags [S], seq 222418307, win 28200, options [mss 1410,sackOK,TS val 1020866101 ecr 0,nop,wscale 7], length 0
14:33:33.799529 IP 10.35.0.220.33642 > test.test.net.https: Flags [S], seq 222418307, win 28200, options [mss 1410,sackOK,TS val 1020866101 ecr 0,nop,wscale 7], length 0
14:33:38.051278 IP 10.35.0.220.33642 > test.test.net.https: Flags [S], seq 222418307, win 28200, options [mss 1410,sackOK,TS val 1020870353 ecr 0,nop,wscale 7], length 0
14:33:38.051295 IP 10.35.0.220.33642 > test.test.net.https: Flags [S], seq 222418307, win 28200, options [mss 1410,sackOK,TS val 1020870353 ecr 0,nop,wscale 7], length 0
14:33:46.243403 IP 10.35.0.220.33642 > test.test.net.https: Flags [S], seq 222418307, win 28200, options [mss 1410,sackOK,TS val 1020878545 ecr 0,nop,wscale 7], length 0
14:33:46.243424 IP 10.35.0.220.33642 > test.test.net.https: Flags [S], seq 222418307, win 28200, options [mss 1410,sackOK,TS val 1020878545 ecr 0,nop,wscale 7], length 0
14:34:02.375302 IP 10.35.0.220.33642 > test.test.net.https: Flags [S], seq 222418307, win 28200, options [mss 1410,sackOK,TS val 1020894677 ecr 0,nop,wscale 7], length 0
14:34:02.375316 IP 10.35.0.220.33642 > test.test.net.https: Flags [S], seq 222418307, win 28200, options [mss 1410,sackOK,TS val 1020894677 ecr 0,nop,wscale 7], length 0
14:34:36.163342 IP 10.35.0.220.33642 > test.test.net.https: Flags [S], seq 222418307, win 28200, options [mss 1410,sackOK,TS val 1020928465 ecr 0,nop,wscale 7], length 0
14:34:36.163353 IP 10.35.0.220.33642 > test.test.net.https: Flags [S], seq 222418307, win 28200, options [mss 1410,sackOK,TS val 1020928465 ecr 0,nop,wscale 7], length 0
14:34:41.283292 ARP, Request who-has 10.35.0.1 tell 10.35.0.220, length 28
14:34:41.283300 ARP, Request who-has 10.35.0.1 tell 10.35.0.220, length 28
```

**Comment by BlackTurtle123** [comment]
EDIT:
It was not a k3s issue in itself.
But a combination from firewall and kubernetes networking.
Therefore closing it
